{
  "run_id": "55555555-5555-4555-8555-555555555555",
  "thread_id": "22222222-2222-4222-8222-222222222222",
  "task_id": "11111111-1111-4111-8111-111111111111",
  "attempt_id": "22222222-2222-4222-8222-222222222222",
  "assistant_id": "meal-assistant-v1",
  "status": "pending",
  "metadata": {
    "task_id": "11111111-1111-4111-8111-111111111111",
    "attempt_id": "22222222-2222-4222-8222-222222222222",
    "release_id": "33333333-3333-4333-8333-333333333333",
    "artifact_sha256": "aaaaaaaaaaaaaaaaaaaaaaaaaaaaaaaaaaaaaaaaaaaaaaaaaaaaaaaaaaaaaaaa"
  },
  "created_at": "2026-10-26T00:00:00Z",
  "started_at": null,
  "completed_at": null,
  "error_code": null,
  "error_message": null
}
